matricule_etudiant;titre_memoire;annee
18A0241P;Performance des modèles numériques dans la simulation des précipitations à l’échelle intra-saisonnières au Cameroun : application aux événements extrêmes (inondation);2020-2021
18A0242P;Performance des modèles numériques sur la simulation des précipitations à l’échelle saisonnières en République Démocratique du Congo : application au paludisme;2020-2021
18A0231P;Diffusion des prévisions agro-météorologiques au moyen de l’application  AGROMET;2020-2021
15E560S;Évaluation des risques et Proposition d’un réseau d’alerte pour la protection contre les inondations du fleuve Logone dans la ville de Ndjamena : cas du 9eme arrondissement de 2000 à 2020;2020-2021
18A0230P;Étude hydrologique des bassins versants de Maroua et Guider pour le dimensionnement en vue de l’implantation des panneaux solaires;2020-2021
18A0238P;Conception d’un logiciel de décodage des messages météorologiques;2020-2021
18A0244P;Évaluation des propriétés hydrauliques des aquifères du socle du bassin versant du Mayo-Tsanaga (Extrême-Nord Cameroun);2020-2021
18A0246P;Performance des modèles numériques sur la simulation des précipitations à l’échelle saisonnières : cas des événements extrêmes des précipitations sur l’Angola;2020-2021
18A0232P;Impact du changement climatique sur les ressources en eau de surface : cas du Logone à Laï;2020-2021
18A0240P;Évaluation de la productivité de la ressource en eau pour les usages domestiques et agricole dans le bassin versant d’Awout à Messam;2020-2021
18A0234P;Analyse comparée entre les données de la station synoptique automatique et les données de la station synoptique manuelle de l’aéroport international de Garoua;2020-2021
18A0228P;Évaluation des apports en eau et pilotage de l’irrigation sur un Hectare d’aménagement hydro-agricole : Cas du périmètre rizicole de Mansen, arrondissement de Bangourain, département du Noun, Région de l’Ouest Cameroun;2020-2021
18A0236P;Gestion de l’eau de Mare pour l’irrigation dans le Logone et Chari;2020-2021
18A0229P;Analyse de la dégradation physique du sol dans les parcelles de l’école technique d’agriculture de Maroua;2020-2021
18A0235P;Performance des modèles numériques sur la simulation des précipitations à l’échelle saisonnières : application à l’agriculture;2020-2021
18A0243P;Conception d’un appareil de mesure automatique du niveau des eaux souterraines;2020-2021
18A0245P;Approvisionnement Durable en Eau Potable Simplifiée : Soulédé-Roua;2020-2021
18A0645P;Traits caractéristiques des saisons sèches et humides du site aéroportuaire de Yaoundé-Nsimalen.;2020-2021
18A0632P;la croissance économique au Cameroun face aux variabilités climatiques observées au cours de la période 2009-2021       ;2020-2021
18A0659P;Épaisseur des couches (925-850hpa), (850-700) et type de temps associé à la station de Garoua durant la période avril-juillet.;2020-2021
18A0660P;Variabilité intra saisonnier des précipitations dans la ville de Douala : cas d’étude du mois d’Août ;2020-2021
18A0551P;Inondations du 12 Août et du 1er septembre 2021 sur la ville de Douala : Variabilités des paramètres clés ;2020-2021
18A0554P;Conception d’un système de collecte de données pluviométriques ;2020-2021
18A0550P;cisaillement du vent à l’aéroport de Garoua durant la période avril-juillet;2020-2021
18A0597P;Les paramètres prédicteurs des précipitations dans la ville de Yaoundé;2020-2021
18A0653P;Time series analysis of cumulonimbus clouds on Nsimalen-Yaounde. case study: the month of October;2020-2021
18A0651P;Essai de caractérisation des pluies enregistrées à la station de Yaoundé-Nsimalen durant l’année 2020;2020-2021
19A740P;Evolution de la température dans la ville de Garoua de 1991 à Août 2021;2020-2021
19A718P;Analyses of the vertical profile of humidity from radiosonde soundings launched from the garoua meteorological station from april to july 2021;2020-2021
19A719P;Evolution des températures à Douala durant la Période de 1991 à 2020;2020-2021
19A725P;Prévision des systèmes d’acquisition de données pour une météorologie nationale productive au Cameroun;2020-2021
19A720P;Droit, collecte, traitement et conservation des données météorologiques au Cameroun;2020-2021
19A722P;Analyse horaires et prévision de décollage : cas de l’aérodrome de Yaoundé-Nsimalen;2020-2021
19A723P;Étude comparée des conditions thermiques et pluviométriques représentatives du climat actuel dans la ville de Garoua de 1991 à 2020;2020-2021
19A724P;Analyse du profil vertical du vent issu des radiosondages à la station de Garoua pendant la période d’avril a juillet 2021;2020-2021
19A721P;Étude de la fréquence d’occurrence des phénomènes météorologiques dangereux sources d’incidents aéronautiques à l’aéroport international de Yaounde-Nsimalen;2020-2021
14A276S;Caractérisation hydrogéologique des aquifères dans la zone de Tokombéré;2016-2017
18A0422P;Dimensionnement d'un bassin de recueillement dans localité de Zina dans la région de l'extrême nord Cameroun;2020-2021
16F280S;Place de l'eau de boisson dans la recrudescence des calculs urinaires dans la ville de Maroua (Extrême-Nord, Cameroun;2020-2021
16F261S;Étude de la qualité des eaux utilisées à l'Hôpital Régional de Maroua (Extrême-Nord Cameroun;2020-2021
14A276S;Analyse situationnelle de l'assainissement dans la commune de Maroua III;2020-2021
16F527S;Analyse situationnelle de l'assainissement dans la ville de Maroua Extrême Nord Cameroun : cas de I 'arrondissement de Maroua II;2020-2021
15E302S;Conception et dimensionnement d'un forage pastoral alimenté par énergie photovoltaïque : cas de Baiga, arrondissement de Tchatibali;2020-2021
19A0168P;Étude hydraulique d’un barrage dans la localité de Touloum.;2020-2021
19A0157P;Caractérisation hydrogéophysique et hydrodynamique des aquifères dans l’arrondissement de Ngwei;2020-2021
19A0159P;Étude d'impact du climat sur les barrages dans la Région de l'Extrême Nord Cameroun;2020-2021
19A0136P;Optimisation d’un réseau de drainage d’une plateforme de poste électrique par procédure multicritérielle : cas du poste 225 kV du barrage de Natchigal;2020-2021
16F447S;Contribution à l'amélioration de la gestion des effluents liquides à l'Hôpital Régional de Maroua;2020-2021
15E039S;Étude hydrologique et hydraulique des ouvrages de franchissement dans le cadre du projet de réhabilitation de la route Maroua-Mora : cas du dalot à double section du PK 45+800;2020-2021
16F199S;Identification et prévention des menaces liées au tarissement des mares dans le parc national de Waza;2020-2021
16F217S;Conception et dimensionnement d'un système d'assainissement des eaux usées et pluviales au CNRPH dans le cadre dc la construction des nouveaux bâtiments;2020-2021
16F249S;Conception et modélisation des réseaux hydrauliques dans le bâtiment siège du centre des archives de la Cour Suprême R+7+l SS : Yaoundé Cameroun;2020-2021
19A0139P;Dimensionnement d'une digue de ceinture en terre contre les inondations dans la localité de Zina, Département du Logone et Chari, région de l'extrême nord Cameroun.;2020-2021
19A0137P;Dimensionnement des ouvrages d'accès et la gestion des eaux à l'intérieur de la digue de protection en terre dans la localité de Zina;2020-2021
16F151S;Dimensionnement d'un système d'alimentation ct d'évacuation d'un bâtiment à usage d'habitation (R+4) Nom II- Yaoundé.;2020-2021
19A0141P;Études techniques en vue de la réalisation d'un système d'adduction en eau potable à Dana, Commune de Yagoua, département de Mayo-Danay;2020-2021
19A0145P;Diagnostic et proposition d'un réseau d'adduction en eau des étangs piscicoles dans la ferme Agropastorale à Yagoua;2020-2021
19A0160P;Conception et dimensionnement du réseau d'alimentation en eau potable : cas de la comme de Ntui;2020-2021
16F262S;Évaluation des rejets liquides et proposition d'un système de réhabilitation de la station d'épuration du cam sic cité verte Yaoundé;2020-2021
15E428S;Évaluation des risques sanitaires et environnementaux liés à la défaillance de certains ouvrages d'assainissement à l'hôpital régional de Maroua dans l'Extrême Nord Cameroun;2020-2021
16F428S;Études spécifiques des travaux de constructions des ouvrages de franchissement sur la route de Maroua-Mora : cas des buses sur le tronçon PK 29+506 dans la localité de Mokio;2020-2021
19A0155P;Étude diagnostique des ouvrages d'approvisionnement en eau potable et assainissement dans la localité de;2020-2021
19A0161P;Diagnostic et conception d'un système d'irrigation par aspersion pour une culture de manioc sur une surface de 1.5ha (cas de l'IRAD de Mbalma o);2020-2021
19A0167P;Étude technique d'aménagement d'un périmètre hydroagricole dans l'arrondissement de Zina : bloc I du sous casier AO de 1215ha;2020-2021
19A0144P;Étude des risques sanitaires liés aux défécations à l'air libre : cas de la commune de Touloum;2020-2021
19A0164P;Étude de l'assainissement liquide dans la ville de Maroua : inondations et maladies liées à l'eau.;2020-2021
18A0137P;Réalisation d’un forage équipé d’une pompe solaire à usage pastoral et mini-AEPs: cas de l’arrondissement de Guidiguis, localité de Sirlawe.;2020-2021
18A0151P;Diagnostic de l’indisponibilité spatiotemporelle de l’eau pour l’élevage dans le canton de Lara : stratégie d’adaptation;2020-2021
18A0117P;Dimensionnement d’un réseau d’adduction en eau potable, d’évacuation d’eau usées et pluviales et recyclage des eaux de pluies en vue de leur utilisation dans un bâtiment de type 2 sous-sol R+2 à usage d’habitation.;2020-2021
20C0656EP;Réalisation d’un forage à motricité humaine à GASCHIGA;2020-2021
20C0657EP;Étude des méthodes de réalisations forations à boue et marteau fond de trou dans la localité de MOKON;2020-2021
18A0126P;Analyse et diagnostic des dysfonctionnements des forages réalisés dans la commune de Touloum;2020-2021
18A0152P;Contribution à l’entretien et à la sauvegarde d’une mare d’eau artificielle : cas de Djingliya dans la commune de Koza.;2020-2021
18A0121P;Dimensionnement d’un système d’irrigation gouttes à gouttes sur un hectare pour la culture du maïs : cas de la ferme semencière de Gazawa.;2020-2021
18A0141P;Diagnostic des sources de dysfonctionnements des forages dans le canton de Zouelva.;2020-2021
18A0147P;Etude d’un projet de forage pastoral à énergie solaire.;2020-2021
18A0123P;Assainissement et drainage d’une mini-cité d’habitation dans la commune de Maroua Ier(Domayo).;2020-2021
18A0129P;Réalisation de deux forages équipés de pompe de motricité humaine dans la localité de Magdeme arrondissement de Mora, département de Mayo-Sava, région de l’Extrême-Nord;2020-2021
18A0149P;Étude de faisabilité pour la mise en place d’un système d’irrigation alimenté par une pompe solaire : cas de Bizili dans la commune de Touloum.;2020-2021
18A0150P;Caractérisation hydrogéologique et hydrodynamique des aquifères dans l’arrondissement de Ndoukoula : cas de la  localité de Loulou et Gawel.;2020-2021
18A0147P;Étude de la mise place d’une adduction d’eau potable alimentée par une source d’énergie solaire : cas de la localité de Moutourwa, département de Mayo-Kani, région de l’Extrême-Nord.;2020-2021
18A0122P;Système de gestion des points d’eau existants dans la zone septentrionale : cas des communes de Maroua Ier, Maroua II et Maroua III.;2020-2021
18A0146P;Étude d’avant-projet de réalisation d’un système d’abreuvoirs alimenté par une pompe solaire : cas du village Aissa-Harde;2020-2021
18A0116P;Impact socio-sanitaires et environnementaux des déchets liquides dans les mini-cités de Maroua.;2020-2021
18A0124P;Évaluation de la connaissance, attitude et pratique du personnel soignant pour la prévention des infections nosocomiales à l’hôpital régional de Maroua;2020-2021
18A0135P;Impacts sanitaires et socio-économiques des inondations sur les habitants de Maroua (cas de Doualaré et Ouro-tchédé).;2020-2021
18A0133P;Risques sanitaires et impacts écotoxicologiques liés aux déchets solides hospitaliers.;2020-2021
18A0125P;Redimensionnement et apport de solution du réseau d’alimentation en eau potable de l’hôpital régional de Maroua;2020-2021
18A0148P;Étude diagnostique des forages en vue de leur réhabilitation/transformation en mini-AEP dans la commune de Kaélé.;2020-2021
20C0658EP;Étude des méthodes de réalisations forations à boue et marteau fond de trou dans la localité de MOKON;2020-2021
20C0662EP;Réalisation d’un forage à motricité humaine à GASCHIGA;2020-2021
17Y509P;Impact  des   subventions    publics dans l’amélioration des conditions de vie des organisations paysannes : cas de PCP-ACEFA;2019-2020
17Y101P;Analyse de la compétitivité de la production du riz dans l’arrondissement de kousseri;2019-2020
16F500S;Atouts et limites des AVEC (association villageoise d’épargne et de crédit) au sein de la communauté de Mokolo;2019-2020
16F229S;Analyse des performances technico-économique des exploitations familiales dans le mayo-tsanaga;2019-2020
17Y163P;Évaluation technico-économique d’un projet de production de 135 Tonnes de maïs sur une superficie de 45 hectare par les membres du GIC référence de Lainde Daneyel;2019-2020
16F519S;Analyse technico-économique de la production paysanne du sorgho sp dans la localité de Mokolo;2019-2020
17Y093P;Évaluation des quelques paramètres agronomique de la variété rio grand de la tomate sous l’effet des différents éléments fertilisants dans la localité de meskine;2019-2020
17Y471P;Évaluation de la rentabilité économique des exploitations familiales agropastorales dans le cadre du programme ACEFA :cas de l’arrondissement deNgaounderé I;2019-2020
17Y185P;Effet de la durée en pépinière sur la reprise et le développement de la plante d’anacarde dans la localité de Bogo;2019-2020
17Y111P;Étude comparative des modalités de travail du sol et leurs influences sur le Riz(VAR IR46) : cas d’un périmètre irrigué de Yagoua;2019-2020
17Y507P;Facteur d’échecs et de réussite de la promotion des cultures maraîchère dans la localité de Kismatari-Nord et Biziligasawa-Extrême-Nord;2019-2020
17Y193P;Effets des insectes ravageurs sur la production du riz de la variété nerica 3 en culture pluviale :cas de l’ordre des lepidoptères et des odonates dans l’agrosystème rizicol de Guiring.;2019-2020
17Y035P;Études de l’adaptabilité de trois variétés de tomates dans l’arrondissement de Maroua 1er;2019-2020
16F236S;Impacts des insectes ravageurs(cas des coléoptères) sur le riz pluvial de variété NIRICA III;2019-2020
17Y086P;Évaluation des connaissances des agriculteurs sur l’usage des pesticides utilisés en cultures maraîchère dans la ville de maroua :cas de Meskine,garde et ziling;2019-2020
17Y027P;Comparaison de l’adaptabilité d’anacard en fonction de provenance dans la localité de Bogo(Extreme-nord Cameroun);2019-2020
17Y511P;Effets des insectes ravageurs(diptères et orthoptères) sur la production de la variété du riz pluvial nerica 3 dans l’agroécosystème de Diamaré.;2019-2020
17Y112P;Diagnostic de la filière semence maïs.;2019-2020
16F131S;Étude comparative des 7 lignées F5 du cotonnier issues du programme de sélection 2019/2020, au témoin vulgarisé IRMA Q302 : cas de kodek(Extrême-nord Cameroun;2019-2020
16F105S;Évaluation du comportement des lignées F7 du cotonnier de série H issues du programme de sélection de la section coton aux variétés témoins vulgarisées IRMA Q302 et IRMA L457 : cas de la zone de kodek(extrême-nord);2019-2020
17Y138P;Mise en place d’une gestion de lutte contre les ravageurs et nuisibles :cas de l’huilerie de la SODECOTON de Maroua;2019-2020
17Y029P;Effet des insectes ravageurs sur la production du Riz nerica 3 en culture pluviale dans l’agrosystème de Diamaré : cas des hémiptères et hymenopteres;2019-2020
17Y002P;Impacts des extraits aqueux des graines de Neem sur le Physoderma  du maïs ;2019-2020
17Y213P;Caractéristiques agronomiques des trois variétés de pomme de terre dans le bassin de production de Rhumzou(Mayo-Tsanaga);2019-2020
17Y209P;Epidémiologie du physoderma du maïs et de la pourriture des tiges par Yamagui Rita;2019-2020
17Y091P;Les mesures de biosécurité dans la ferme porcine de la Fondation Bethléem de Mouda.;2019-2020
17Y229P;Appétence d’ un Fourrage Vert Cas De Eratica Espera;2019-2020
16F161S;Effet de Ipomoea pes-caprae à différente dose sur les paramètres zootechniques du lapin;2019-2020
17Y201P;Étude des quelque facteurs influencent la réussite de l'insémination artificielle :cas des bovins dans l'arrondissement de ngaoudere 1ere.;2019-2020
17Y097P;Les colorants alimentaires naturelles et leurs utilisations sur les produits laitiers : Essais sur le yaourt brassée et la crème glacée;2019-2020
17Y032P;Essai de formulation de biscuits à base souchets (Cyperus esculentus L.);2019-2020
17Y007P;Production et caractérisation du jus de Carissa edulis;2019-2020
17Y060P;Analyse technico-économique de la production soja dans l’arrondissement de Mokolo;2019-2020
17Y050P;Appui du gramme ACEFA et autonomisation des organisations paysannes dans le département du Logone et Chari :cas de l’arrondissement Logone-Birni, Kousseri et Makary;2019-2020
15E960S;Impact socio-économique du conseil offert aux groupements accompagnés par le programme PCP-ACEFA : cas de Makary;2019-2020
17Y146P;Analyse technico-économique de la production de la tomate dans l’arrondissement de Mokolo :contraintes et stratégie d’acteurs;2019-2020
17Y126P;Évaluation des membres des organisations de producteurs sur le fonctionnement et le mode de gestion;2019-2020
16F520S;Sécurité alimentaire dans l’arrondissement de Maroua 1er : état des lieux et stratégie d’amélioration;2019-2020
17Y515P;Effets du financement sur les exploitations familiales agropastorales(EFA) : cas des AFA accompagnés par le PCP-ACEFA dans le diamaré;2019-2020
18A0620P;Évaluation du mécanisme d’octroi du crédit agricole et leur recouvrement à la SODECOTON de Maroua 2;2019-2020
17Y476P;Analyse de l’impact du COVID-19 et résilience économique : cas de la filière tomate dans le département du Diamaré;2019-2020
17Y520P;Production du sorgho pluvial : analyse de gestion de la production dans le département du Mayo-Tsanaga : cas du CROPSEC;2019-2020
17Y062P;Contribution du PRODEL dans la promotion du développement socio-économique des populations démunies du Diamaré :cas de la commune de Maroua 1er;2019-2020
17Y508P;Diagnostic organisationnel et technique du groupement des producteurs de soja de Mbikem;2019-2020
19A0501P;Étude technico-économique des organisations paysannes :cas de la scoops de tchoffabani;2019-2020
18A0019P;Étude de l’adaptabilité de 0 accessions de sorgho pluvial dans la zone soudano-sahélienne;2020-2021
18A0012P;Étude comparative de deux variétés du sorgho dans la ferme semencières de Gazawa;2020-2021
18A0027P;Évaluation des performances agronomiques de six accessions de sésame collectées  dans la région  de l’Extrême Nord;2020-2021
18A0024P;Analyse de la performance économique de la filière Anacarde dans le Département de Diamaré;2020-2021
18A0015P;Étude de la rentabilité d’une entreprise cas de Ets SOTRALAIT;2020-2021
18A0016P;Rentabilité d’une ferme : cas de la ferme agropastorale de Foulwayna à Yagoua.;2020-2021
18A0022P;Évaluation de l’efficacité biologique des extraits de plants pour le contrôle de la chenille sur le la culture du sorgho pluvial;2020-2021
18A0010P;Caractérisation Agromaorphologique de 03 cultivars du niébé dans le Département  de Mayo Tsanaga.;2020-2021
18A0034P;Effet comparé de quelques performances  zootechniques des alévins  élevés en étang fertilisé;2020-2021
18A0011P;Étude comparative des lignées F7 représenté par la série du cotonnier issues du programme de la sélection en année 1 (EVA1)) de la campagne 2020/2021 aux témoins vulgarisés IRMA Q302 et IRMA L457 : cas de Kodek Extrême-Nord Cameroun;2020-2021
18A0002P;La culture du sorgho pluvial dans la localité de Katoual, Ville de Maroua;2020-2021
15E707S;Effet des dimensions de Trouaison sur la reprise de la croissance de l’Anacarde à You;2020-2021
18A0030P;Caractérisation agromorpholique de 09 accessions de Souchets sous l’effet de la cendre et d’un fertilisant minéral à l’Extrême-Nord;2020-2021
18A0003P;Professionnalisation des organisations paysannes dans la localité de Koza;2020-2021
18A0035P;Effets de deux de fertilisants chimiques : Uré à 46% d’N et le NPK sur la croissance et développement des bananes dans le bassin versant de TGODJO;2020-2021
17Y121P;Screening des contraintes inhérentes à la production des semences de Niébé dans la frme de multiplication et de production de semence à GAZAWA;2020-2021
18A0026P;Étude des facteurs déterminants la demande du riz sur le marché (Extrême Nord);2020-2021
18A0018P;Impact des maladies cryptogamiques sur la culture du Niebé dans la zone de Mokolo;2020-2021
18A0032P;Essai de formulation d’une ration alimentaire à base d’ingrédients locaux à moindre coûts pour vaches laitières ;2020-2021
18A0028P;Amélioration de l’incubation en cuve en vue de l’optimisation du rendement de la production à SOTRALAIT;2020-2021
18A0001P;Adaptabilité de trois espèces de Baubou pour la restauration des sols dégradés dans la ville Waza;2020-2021
18A0036P;Influence de la densité et des paramètres physicochimiques de l’eau sur la croissance et la survie des alevind dans la ferme avicole et aquacole du septentrion;2020-2021
18A0029P;Amélioration organoleptique du beurre produit à SOTRALAIT;2020-2021
18A0014P; Amélioration et standardisation des propriétes organoleptiques du yaourt ferme MIRA;2020-2021
18A0007P;Étude techno-economique de la production d’oignon dans le Département du Diamaré : Cas de Meskine;2020-2021
18A0004P;Influence de quelques mesure de Biosécurité sur la santé et la qualité du lait de vaches dans l étable de la ferme du Septentrion;2020-2021
18A0153P;Screening  des descripteurs de qualités des peaux et cuirs du déparasitage et du preszchage dans la ville de Maroua;2020-2021
18A0154P;Analyse des effets socio-econo formation auprès des jeunes et des femmes dans le Département du Diamaré commune de Bogo;2020-2021
18A0031P;Évaluation de l’adaptabilité et caractérisation Agro morphologique de 06 variétés du petit mil dans la zone Soudano sahélienne;2020-2021
18A0555P;Utilisation du Regulateur de croissance sur le cotonnier en milieu paysan dans le secteur SODECOTON;2020-2021
18A0033P;Capture et suivi des colonies d’abeilles dans les ruches modernes pour la reproduction de miel de qualité dans le bassin versant de Togodjo;2020-2021
18A0025P;Étude comparative  de deux variétés du Niébé pour la résistance aux pucerons dans la région de l’Extrême-Nord;2020-2021
18A0009P;Évaluation de la rentabilité financière de la production de 09 souchets dans la zone de l’Extrême-Nord;2020-2021
18A0021P;Caractérisation morphologique de cinq noix de cajou sur la germination à Maroua;2020-2021
18A0008P;Analyse Technoeconomique de la production du sorgho pluvial dans l’arrondissement de Maroua 1er;2020-2021
18A0386P;Effet comparé de quelques pesticides biologiques et chimiques sur les attaques des chenilles légionnaires sur trois variété de maïs dans l’Extrême-Nord Cameroun;2020-2021
18A0005P;Étude de l’utilisation des produits phytosanitaires par les producteurs de maïs dans l’arrondissement de MOKOLO;2020-2021
20C0555EP;Étude des formules alimentaire pour l’embauche bovine;2020-2021
20C0595EP;Mesure de Biosécurité , mise en places dans les fermes avicoles de Wouro;2020-2021
20C0557EP;Étude de rentabilité technoéconomique des unité de stockage d’oignon dans le Département du Diamaré;2020-2021
20C0559EP;Évaluation d’hygiène et biosécurité dans une ferme avicole de centre de formation Agropastoral et informatique de Marza;2020-2021
20C0560EP;Analyse de la chaîne de valeur manioc dans la région de l’Est Cameroun;2020-2021
20C0561EP;Effet des engrais NPK et PK sur la croissance du soja dans le Département du Mayo-Tsanaga;2020-2021
20C0562EP;Adaptabilité de trois variétés améliorées de manioc à Sanguré;2020-2021
20C0596EP;Évaluation de la méthodologie d’accompagnement des producteurs du coton;2020-2021
20C0563EP;Analyse du niveau de fonctionnement des organisations des producteurs;2020-2021
20C0564EP;Étude de l’effet des différentes formulations d’engrais minéraux sur la croissance et le rendement du riz dans les bas-fond de la vallée de la Bénoué;2020-2021
20C0566EP;Effet de la plante Ortie sur les performances de ponte des poules pondeuses;2020-2021
20C0567EP;Amélioration de la productivité et de la rentabilité du coton;2020-2021
20C0568EP;Évaluation de la rentabilité économique de la production d’aubergine dans la localité de BAZZAMA;2020-2021
20C0570EP;Renforcement de la résistance à la chaleur et des qualités sensorielles du beurre;2020-2021
20C0571EP;Évaluation des performances agromorphologiques de deux variétés locales de morelle noire à Sangmelima;2020-2021
20C0572EP;Essai de formulation du Kilishi en farce en vue d’une automatisation du procédé;2020-2021
20C0574EP;Essai de caractérisation de cinq procédés de fabrication carnée de consommation directe;2020-2021
20C0575EP;Conduite de l’embouche bovine dans le Département du Diamaré;2020-2021
