matricule_etudiant;titre_memoire;annee
15E597S;Analyse de la filière niébé dans la région de l’Extrême-Nord;2016-2017
15E474S;Contribution du BELACD-CARITAS LAI dans la mise en œuvre du projet sécurité alimentaire pour un développement socio-économique de la tandjilé (TCHAD) : cas de la riziculture de contre saison;2016-2017
14A177S;Importance du conseil agricole dans l’accompagnement des organisations paysannes pour la lutte contre l’insécurité alimentaire dans la région de l’Extrême-Nord du Cameroun : cas de la commune de Mokolo;2016-2017
14A036S;Évaluation de la contribution de l’appui financier au niveau des groupements de producteurs accompagnés par le programme au développement des emplois ruraux;2016-2017
14A180S;Contribution du conseil technico-économique au développement des groupements  de producteurs : cas du département de la Benoué;2016-2017
14A261S;Évaluation des effets de l’appui conseil au sein des groupements des producteurs agricoles du Diamaré : cas du programme ACEFA;2016-2017
15E525S;Evaluating the effects of ACEFA's financial support on the activities of farmers organizations in the Diamaré;2016-2017
12X380S;Évaluation du conseil agricole dans le développement des activités économiques des exploitations familiales agropastorales : cas de l’observatoire du programme ACEFA;2016-2017
15E737S;Étude comparative de la rentabilité socio-économique des filières soja et souchet dans le Nord Cameroun : cas de la partie Sud-Ouest du département de la Benoué.;2016-2017
12X010S;Évaluation des appuis promus par le programme d’appui aux PME agricoles et agroalimentaires (PMEAA) dans la région de l’Ouest Cameroun ;2016-2017
12X130S;Résistance à la rouille et performance de quelques variétés de soja sur sol amandé aux feuilles de Tithonia diversifolia;2016-2017
15E935S;Évaluation de la résistance à la sécheresse d’un hybride mutant de niébé ;2016-2017
15E373S;Evaluation of the effet to pre-treatement techniques on the germination of oil palm seeds;2016-2017
12X038S;Effet de la fertilisation organique sur la croissance et le rendement de la tomate sur les sols de Maroua;2016-2017
14A716S;Évaluation de l’effet des biopesticides sur les maladies et ravageurs de la tomate : cas de l’urine de vache et l’extrait du neem  ;2016-2017
14A109S;Effet du tallage aérien de 12 variétés du sorgho repiqué dans la région de l’Extreme-Nord ;2016-2017
15E895S;Étude de l’effet du compost à base de jathropha  curcas et la fertilisation minérale sur les performances agronomique et le rendement du gombo à kismatari Nord-Cameroun ;2016-2017
12X189S;Évaluation du pouvoir germinatif de la morelle africaine dans la localité de Njombé;2016-2017
14A541S;Evaluation of the rooting capacity of cocoa hybrids dissiminated in the 5th agro ecological zone of Cameroon;2016-2017
12X070S;Caractérisation morphologique du poivrier dans les régions du Centre et du Littoral au Cameroun;2016-2017
15E382S;Effet des prétraitements sur la croissance initiale de six provenances de Faidherbia albida de la zone soudano-sahélienne du Cameroun;2016-2017
14A561S;Étude comparative de la fertilité du sol par un apport de fumure organique, de champignons mycorhiziens et d’engrais minéraux pour les cultures maraîchères : cas de la pastèque à FOMAKAP.;2016-2017
11V420S;Réponse de la tomate à la fertilisation chimique, organique et biologique dans la région de l’Extrême-Nord ;2016-2017
15E225S;Évaluation de l’effet de la densité sur le rendement de deux types d’ail dans la région de l’Extrême-Nord- Cameroun ;2016-2017
15E739S;Diversité des insectes ravageurs de la pastèque et quelques méthodes de protection pratiquées à Yagoua ;2016-2017
15E863S;Étude de la diversité génétique de la population du Niébé par les marqueurs microsatellites;2016-2017
14A452S;Évaluation de l’effet des engrais minéraux sur les paramètres de croissance, de développement et de rendement de la culture d’ail dans la localité de Maroua;2016-2017
12X312S;Adaptabilité de trois variétés de riz en saison chaude pour une combinaison optimale densité de semi-dose d’engrais dans le Département du Mayo-Louti;2016-2017
11V425S;Évaluation de la production et de la résistance au bio-agresseur des riz Nerica 3 et IR 46 dans l’agroécosystème de Maroua ;2016-2017
14A230S;Valorisation de la drèche de bil-bil et de l’effluent de harki comme complément à l’embouche des ovins dans la ville de Maroua. ;2016-2017
12X297S;Effet de la supplémentation des drêches de bil-bil et d’azardirachta indica sur les performances de croissance des lapins dans la région de l’extrême-nord. ;2016-2017
15E207S;Effet de la substitution du maïs par la drèche des brasseries dans l’alimentation des poulets de chairs.;2016-2017
15E011S;Evaluation de l’effet des résidus de récolte sur la croissance des ovins : cas des fanes d’arachides.;2016-2017
14A100S;Effet de l’urée sur l’amélioration de la production laitière  des vaches Simgouds au ranch de la SODEPA Faro et Deo.;2016-2017
14A705S;Étude comparative des aliments d’intrants locaux (son de mil, tourteau de coton) et des aliments artificiels avec la fertilisation organique (fiente de poules pondeuses) sur les performances zootechniques de tilapia.;2016-2017
15E976S;Essai de substitution du tourteau de coton par les feuilles de  zizyphus mauritiana enrichi à l’urée pour l’engraissement des caprins  dans la région de l’Extrême-Nord Cameroun. ;2016-2017
15E111S;Incubateur et productivité des poules villageoises : cas de la ferme agropastorale de Foullouwayna  du CODAS CARITAS de Yagoua.  ;2016-2017
12X141S;Essai de substitution du maïs par le sorgho CS 54 germé dans la l’alimentation des poulets de chairs. ;2016-2017
14A707S;Effet de la substitution partielle de la farine de maïs par la farine de cabosse de cacao sur les performances de croissances et de survie des alevins de Cyprinus carpio.;2016-2017
15E584S;Evaluation des performances du sorgho Mandjéri dans l’alimentation des poulets de chairs.  ;2016-2017
12X274S;Valorisation des sous-produits agricoles dans la pisciculture dans le Département de la VINA.;2016-2017
14A421S;Effet de la densité sur les performances des larves de la carpe commune en système hors sol, fertilisé à la fiente de poule et supplémenté à l’aliment artificiel. ;2016-2017
15E301S;Influence des médicaments utilisés en prophylaxie sur les paramètres zootechniques et sur la santé des Lapins : cas de la ferme expérimentale de Nkolbisson.;2016-2017
15E374S;Influence de l’alimentation (bale du riz, son de maïs et tourteau du coton) sur la production laitière à Maroua- Cameroun. ;2016-2017
15E550S;Étude de la production laitière des vaches dans les zones périurbaine de N’Djamena. ;2016-2017
11V015S;Enquête épidémiologique de la brucellose dans la région de l’Ouest cas de l’arrondissement de Koutaba.;2016-2017
15E545S;Reproduction des clarias;2016-2017
09K320S;Pasture resources in PETE sub division of the Far-North Region of Cameroon.;2016-2017
15E738S;Effet compares de incorporation de deux fourrages : Azadirachta indica et Arachis hypogaea sur les performances de reproduction des lapines et de la viabilité des lapereaux dans une ferme cunicole du département du Diamaré. ;2016-2017
12X307S;Élevage des petits ruminants et circuits de commercialisation de la viande des petits ruminants dans l’arrondissement de Maroua II.;2016-2017
14A188S;Effet de l’incorporation des épluchures de concombre sur les performances de croissance des lapereaux après sevrage.;2016-2017
16F152S;Innovation locale : utilisation du « kanwa » (sel gemme) pour réduire le goût amer du chocolat;2017-2018
13Z164S;Formulation du concentré sucré du lait de soja;2017-2018
16F082S;Transformation de la mélasse en produits de la distillerie;2017-2018
15E728S;Influence de la matière première et du procédé sur la qualité hygiénique et sensorielle du « kilishi »;2017-2018
14A329S;Amélioration du rendement de la matière grasse des graines de coton à l'extraction et analyse des pertes raffinerie.;2017-2018
14A326S;Évaluation des apports nutritionnels et accès des aliments par les enfants de 6-59mois dans les familles dans le camp des réfugiés de Minawawo.;2017-2018
13Z156S;Management des risques qualité organoleptiques de la bière;2017-2018
13Z097S;Amélioration du fonctionnement de la station Cleaning In Place (CIP) automatique en salle de brassage ;2017-2018
16F112S;Valorisation des balles de riz (Oryzasativa) par la fabrication briquettes combustibles en vue de l’étuvage du riz ;2017-2018
13Z147S;Étude de l’origine de pourritures des tubercules des pommes de terre (Solanum tuberosum) et proposition d’une méthode de conservation : cas de coop CA Babajou;2017-2018
16F157S;Maîtrise de la qualité microbiologique de la bière en filtration;2017-2018
16F308S;Structuration des organisations féminines transformatrices de Karité : cas Belacd-caritas  de SARH au Tchad;2017-2018
16F085S;Autonomisation des personnes vulnérables à travers l’agriculture;2017-2018
15E366S;Impact de l'approche HIMO sur la réduction de la pauvreté dans les zones bénéficiaire. Cas de Wina et de Gobo;2017-2018
12X073S;Analyse de la chaîne de valeur de l’oignon dans le bassin de production de Doumourou dans le Département du Mayo-Kani Région de l’Extrême-Nord;2017-2018
13Z167S;Analyse des performances technico économiques des exploitations familiales agricoles dans le département de Mayo Tsanaga Extrême-Nord Cameroun accompagnées par le comité  diocésain de développement;2017-2018
13Z291S;Impact de la certification sur les performances des systèmes Agroforsterie à base de Cacao (SAFC) traditionnels au centre Cameroun;2017-2018
15E731S;Autonomisation des producteurs du département de la Bénoué (Garoua) par la pratique du warrantage;2017-2018
13Z289S;Retombées socio-économiques de la modernisation de la filière Neem dans la localité de Maroua;2017-2018
13Z427S;Test d’adaptabilité  de quelques  variétés de niebé dans la localité Mayo Meessala;2017-2018
16F124S;Inventaire des syrphidea (Diptère) en rapport avec les ressources florales dans la zone agricole de Meskine (Extrême-Nord Cameroun);2017-2018
16F018S;Impact des biopesticides sur les cultures maraîchères;2017-2018
16F312S;Impact du calendrier de culture sur le rendement du riz (oryzasatva);2017-2018
16F564S;Vegetative Propagation By Cuttings Of Selected Clones Of Robusta Coffee(Coffeacanephora) In Different Rooting Substrates;2017-2018
16F088S;Évaluation agronomique de 4 variétés de sésame introduite en zone  soudano sahelienne;2017-2018
13Z074S;Effet du poids de la graine et du niveau de fertilisation sur la croissance de l’anacardier;2017-2018
12X012S;Faisabilité de la culture des Sorghos pluviales en contre saison dans la zone soudano sahélienne: Cas de Maroua;2017-2018
16F126S;Étude de l'activité biopesticide des extraits poudreux des plantes dans la conservation du niébé (Vigna unguiculata ) dans la région de l'Extrême-Nord Cameroun;2017-2018
13Z236S;Performance agronomique de la culture de la laitue en pot fertilisé aux extraits organiques;2017-2018
16F488S;Effet de trois modes de prélèvement des semences à l’épi sur la croissance et le rendement d’une variété de de maïs (Zea mays l.)  dans le littoral Cameroun : IRAD de Njombé;2017-2018
13Z738S;Répercussions des visites florales d’insectes sur la pollinisation et les rendements d’Abelmoschus esculentus (Malvaceae) à Nkolbisson (Yaoundé, Cameroun);2017-2018
15E186S;Adaptabilité agromorphologique  de  5 variétés d’oignons de saisons pluvieuse dans la zone soudano-sahélienne de l’Extrême-Nord Cameroun;2017-2018
13Z153S;Réponse a la croissance et au rendement de trois variétés du haricot vert  soumises à trois itinéraire techniques (14 23 14 ,7 18 30, 14-23-14+ solupotasse) sur un andosol à l’ouest Cameroun : cas de la localité de Foumbot;2017-2018
13Z174S;Impact des types de fertilisants : chimiques,  organiques et biologiques et des modes d'approvisionnement  en eau sur 5 variétés de pommes de terre. Cas de Maroua, Extrême-Nord.;2017-2018
16F142S;Effet de la substitution dans la ration alimentaire du maïs par les épluchures de patate (Ipomoea batatas) sur les performances de reproduction des lapines (Oryctalagus cuniculus domesticus) en zone soudano-sahélienne.;2017-2018
16F346S;substitution du maïs par le mil rouge dans l’alimentation des poulets de chair;2017-2018
15E857S;Performances de croissance des chèvres du sahel supplémentés avec du fourrage ligneux;2017-2018
16F195S;Étude comparée de l’effet  de différents taux de supplémentation des asticots vivants sur les performances zootechniques des alevins du poisson-chat africain, Clarias gariepinnus (Burchell, 1822);2017-2018
16F182S;Substitution du tourteau de soja  par la farine de niébé blanc dans l’alimentation des poulets de chair.;2017-2018
16F020S;Étude comparative de deux types  d'aliments (tourteaux de sésame et pelure de patates) sur les performances zootechnique des lapins après le sevrage;2017-2018
13Z148S;Effet de la substitution du son de maïs par les drêches de bili-bili (séchées) sur les performances de croissance des mouton dans la ferme ovine de SCOOPSIPOMA;2017-2018
16F314S;Effet de la farine de luzerne supplée à l’aliment des lapines allaitantes sur la croissance des lapereaux;2017-2018
16F068S;The comperative study of the effect of 2 rations :Bidens pilosa(Black jack)and Cynodon dactylon(Bahama grass)on the zootechnical performances and Carcass characteristics of fattened goats;2017-2018
15E860S;Évaluation du taux d'éclosablilité et qualité du poussin d’un jour dans la ferme NGV/TRACO;2017-2018
15E354S;Effet de trois rations à base de banane sur la croissance des jeunes porcs en zone côtière;2017-2018
13Z798S;le parasitisme d'Apis mellifera et son effet sur la production de miel;2017-2018
16F076S;"Étude comparative  des rations supplémentées aux plantes tropicales (Azatirata indica ; Ipomea pes caprae ; Manguifera indica) comme fourrage afin d’améliorer les performances de croissance des lapereaux (Oryctolagus cuniculus) dans une ferme cunicole de Maroua. ";2017-2018
16F048S;Évaluation de la pression vectorielle dans les pâturages et les stratégies de lutte anti vectorielle mise en œuvre par les éleveurs dans l’arrondissement de Pétté, Extrême-nord Cameroun;2017-2018
12X622S;Effets comparés de l'hormone synthétique (OVAPRIM) et de l'hormone biologique (hypophyse)sur les performances de la reproduction de Clarias gariepinus.;2017-2018
16F206S;Phenotypic (Physical And Morphometic) Characterisation Of Indegenous Pig Breeds In Three Regions Of Cameroon (Centre, Far North And West Regions).;2017-2018
14A710S;Efficacité technico-économique d’embouche à base des sous-produits agro-industriels : cas du coton;2017-2018
16F382S;Effet des fertilisants organiques sur le mode de propagation (semi et bouturage) d’Artemisia annua en pépinière et en champ;2020-2021
17Y200P;effets des substrats et les modes de semis sur la croissance et le développement duS dans la culture du sorgho;2020-2021
19A0003P;Essai d'alimentation à base de Piliostigma Thonningii et de Faidherbia albida en système intensif d'embouche bovine dans la zone sub-humide et semi-aride du Cameroun;2020-2021
19A0005P;Évaluation du potentiel fixateur d’azote de dix (10) accessions d’arachide (Arachis hypogaea) dans la Région de l’Extrême-Nord Cameroun;2020-2021
15E117S;Effet des milieux de cultures sur les paramètres bio morphologiques de  Fusarium oxysporum sp de niébé et leur pathogénicité;2020-2021
19A0007P;Résiliation des producteurs agricoles et enjeu économique : cas du département de Mayo Sava;2020-2021
19A0008P;Test d’efficacité  de cinq (05) extraits de plantes pour la lutte contre certains ravageurs du sorgho ( Sorghum bicolor);2020-2021
19A0009P;Effet de la substitution de la farine de poisson par la farine d’asticots sur les performances zootechniques de croissance des poulets de la race Brahma.;2020-2021
19A0010P;Analyse de la performance technico-economique des producteurs des carottes dans le Département du Diamaré;2020-2021
16F298S;Effets de la farine d’asticots sur les performances Zootechniques de Clarias;2020-2021
14A364S;Évaluation des effets de deux hormones sur le greffage du cacaoyer (Theobroma cacao l) dans la localité de Nkoemvome ( Sud Cameroun);2020-2021
19A0013P;Évaluation du potentiel  d’un inoculum rhizobium commercial par rapport  à l’efficiente symbiotique  sur 02 espèces de légumineuses (Vigna unguiculata et Glycine max);2020-2021
19A0014P;Diversité des fusarium spp responsables de la fusariose du Striga chez le sorgho (Pennisetum glaucum)  à l’Extrême-Nord Cameroun;2020-2021
16F282S;Conservation de la carotte (Daucuscarota) à travers deux techniques : le séchage et le saumurage;2020-2021
16F397S;Exploitation des pelures de manioc et élimination du cyanure par des techniques endogènes;2020-2021
16F273S;Effet de la farine d’asticot sur les performances zootechnique du lapin;2020-2021
16F376S;Adaptabilité de 08 lignées de riz irrigués en réponse avec les différentes doses de NPK dans le bassin de production de Lagdo.;2020-2021
19A0021P;Effet d'un biofertilisant associé au thé de compost sur la croissance et le rendement de gombo dans la zone péri-urbaine de Maroua( Extrême- Nord, Cameroun);2020-2021
16F192S;Évaluation des productivités des facteurs contraignants à la production des bulbes d’oignons dans la Région de l’Extrême-Nord;2020-2021
19A0023P;Évaluation des effets des biopesticides produit à base d’un extrait aqueux de piment, tabac et leurs effets combines contre les pucerons du gombo (Abelmoschus esculentus) dans l’Extrême-Nord localité de zala;2020-2021
16F291S;Test de Fertilisation à base de l’urine humaine (comparaison avec les autres fertilisants : fientes de poules et engrais chimique) : Cas du maïs (Zea mays);2020-2021
19A0025P;Évaluation des performances zootechniques des actifs productifs et amélioration de la résilience des ménages vulnérables dans le Département du Mayo-Kani;2020-2021
16F305S;substitution du cocktail d’épices par les huiles essentielles dans le procédé de fabrication du Kilishi et du Kilishi en farce;2020-2021
19A0027P;Étude de l'activité phytohormonale (auxine et cytokinine) et l'effet du substrat sur le bouturage de Artemisia annua;2020-2021
19A0028P;Production des asticots dans localité de Maroua : étude de quelques facteurs d’influence;2020-2021
19A0029P;Évaluation de la qualité hygiénique et nutritionnelle du lait cru utilisé par la SOTRALAIT SA Maroua;2020-2021
16F277S;Adaptabilité de six variétés de tomates par la technique de bouturage;2020-2021
18A0438P;Niveau d’appropriation des outils de gestion et performances des  EFA de l’observatoire;2020-2021
19A0035P;Essaie de capture, transfert et élevage des colonies d’abeilles du genre apis Mellifera adensoni pour la production du miel de qualité dans la zone périurbaine de Maroua (Extrême Nord Cameroun);2020-2021
15E330S;Caractérisation des EFAs de l’observatoire et enjeux économiques de leur exploitation;2020-2021
19A0038P;Évaluation de l'effet du substrat sur la levée et la croissance de l'igname (Dioscorea rotundata spp) en miniset;2020-2021
16F268S;Évaluation de l'effet des fertilisants minéraux et des fertilisants organiques sur la productivité du maïs dans la localité de Njombé;2020-2021
19A0040P;Efficacité économique et rentabilité financière des unîtes de production de tomate dans le département de Diamaré;2020-2021
19A0041P;Production d’un vin blanc d’anacardier;2020-2021
19A0042P;Modèle de consommation alimentaire des ménages ruraux et sécurité alimentaire;2020-2021
19A0043P;Effets des substrats, des hormones et la provenance sur  l’enracinement de poivrier (Piper nigrum.L);2020-2021
16F255S;Pratiques innovantes pour  la lutte contre les ravageurs du cacaoyer dans la localité de MFomo;2020-2021
19A0047P;criblage des variétés de sorgho pluvial (Sorghum bicolor) a doubles usages contre Striga hermonthica;2020-2021
16F203S;Évaluation de la qualité microbiologique et nutritionnelle des produits laitiers (yaourt, beurre, fromages, crème glacée);2020-2021
19A0049P;Étude comparative de deux méthodes d’aménagement des parcelles agricoles : méthode classique (ancienne) et la méthode nouvelle.;2020-2021
15E463S;Dimensionnement hydraulique des ouvrages des ouvrages d’art (cas des dalots sur les Mayo) de la route Makalingai-Tokombéré dans a région de l’extrême Nord.;2019-2020
15E1078S;Étude technique et financière de la réhabilitation du réseau d’alimentation en eau potable et d’évaluation des eaux usées de la CNRPH de Yaoundé.;2019-2020
13Z688S;Étude hydrologique et hydraulique des ouvrages de franchissement et longitudinaux sur la route Maroua-Mora.;2019-2020
15E137S;Études spécifiques des travaux de construction des drains principaux dans la ville de Maroua : cas des quartiers Pitoiré et Doursoungo.;2019-2020
15E376S;Étude de faisabilité pour la réalisation d’un système d’approvisionnement en eau potable simplifiée (AEPS) et gestion des eaux de pluie dans les projets d’aménagement : cas des cent (100) logements sociaux de Maroua.;2019-2020
15E125S;Études hydrologiques et hydrauliques des ouvrages de franchissement dans la ville de Maroua : cas de deuxième pont Makabai sur le Mayo Tsanaga.;2019-2020
15E220S;Contribution à l’amélioration du réseau d’alimentation en eau potable de la ville de Maroua.;2019-2020
15E171S;Conception du système d’assainissement en eau potable en vue d’améliorer les conditions d’accès à l’eau potable dans la commune de Koutaba : cas des villages Koumenke.;2019-2020
15E915S;Évaluation du système d’irrigation goutte à goutte de la culture de tomate : cas de la ferme agropastorale de Foulouwayna à Yagoua.;2019-2020
15E187S;Diagnostic du réseau existant et optimisation de la gestion de l’eau dans les périmètres rizicoles de la SEMRY : cas du casier III du périmètre de la SP 21.;2019-2020
15E916S;Études diagnostic et amélioration d’un système d’approvisionnement en eau potable dans l’arrondissement de Koutaba : cas des villages Didango, Koumelap, Koutaba, Leposerie, Ngoundoup, Koundja.;2019-2020
15E426S;Aménagement d’un périmètre irrigué pour la culture de banane plantain dans la localité de Njombé-Penja.;2019-2020
15E718S;Dimensionnement d’un réseau d’AEP couplé au système d’informations géographiques : cas du tronçon Nkometou-Soa sur le projet paepys;2019-2020
18A0503P;Caractérisation hydrologique des sites potentiels pour la construction des barrages de retenue d’eau dans la région de l’Extrême Nord.;2019-2020
18A0552P;Risques sanitaires et environnementaux liés à la pratique de la riziculture dans la localité de Pouss(Extrême Nord Cameroun).;2019-2020
14A594S;Route et prévention contre les effets néfastes de l’eau (projet de réhabilitation de la route bitumée Maroua-Mora).;2019-2020
18A0578P;Accès à l’eau potable, à l’assainissement en milieu rural des points d’eau : cas de la commune de Kar-Hay.;2019-2020
18A0506P;Assessment of the bacteriological quality of drinking water in Limbe and it’s heath impact case study: spring and boreholes.;2019-2020
15E073S;Étude hydrologique et dimensionnement hydraulique d’un ouvrage de franchissement sur la route Yaoundé – Kribi : Olama – Bingambo (108km).;2019-2020
18A0509P;Le lac municipal d’Ebolowa, un réservoir parasitaire à risque pour la santé humaine et environnementale.;2019-2020
18A0505P;Bio-évaluation de l’eau des rizières de la localité de Pouss (Extrême-Nord, Cameroun) en vue de la pratique rizipisculture.;2019-2020
14A475S;Analyse de l’offre et de la demande des services d’assainissement liquide dans la région de l’extrême Nord (cas de Mokolo).;2019-2020
18A0510P;Risques environnementaux et sanitaires liés à la gestion des déchets hospitaliers : cas de l’hôpital de district d’Akonolinga;2019-2020
15E917S;Techniques d’approche IECCC pour l’amélioration de l’environnement sanitaire et humain des populations du Mayo Kaliao, arrondissement de Maroua 1er : cas du quartier Pitoaré. IECCC : Information, Education, Communication pour le Changement de Comportement;2019-2020
15E1080S;Évaluation physico-chimique et bactériologique des eaux de boisson du quartier Nkomo.;2019-2020
15E717S;Concentration, biodisponibilité et évaluation du niveau de risque lié aux métaux lourds dans le lac Maga, Extrème-Nord Cameroun.;2019-2020
15E180S;Recherche des métaux lourds dans les poisons des canaux rizicoles de Pouss.;2019-2020
18A0494P;Proposition d’un système d’assainissement liquide pour les logements sociaux de Beka Matari de la ville Ngaoundéré Région de l’Adamaouaa .;2019-2020
14A530S;Qualité physico-chimique des eaux du lac Maga(EN) et évolution des risques pour la santé liés aux protistes Giardia et Cryptosporidium.;2019-2020
18A0507P;Approvisionnement en eau potable et assainissement en milieu rural pour un développement durable.;2019-2020
18A0504P;Étude diagnostique des pratiques d’hygiène et assainissement, et estimation de risque sanitaire dans la ville de MAROUA : cas des quartiers Doualaré et Pont-Vert.;2019-2020
18A0239P;Distribution of Lighting Strikes in Cameroon using Earth Networks System from April to July 2021;2020-2021
